{
  "document_id": "document_5_attention_masks",
  "title": "Attention Masks, Sequence Identifiers, and Batched Inference",
  "metadata": {
    "schema_version": "2.0.0",
    "source_file": "document_5_attention_masks.tex",
    "source_length": 10254,
    "node_count": 51,
    "nonempty_node_count": 51,
    "node_type_counts": {
      "abstract": 1,
      "cases": 2,
      "document": 1,
      "equation": 4,
      "paragraph": 29,
      "section": 12,
      "subsection": 2
    },
    "tokenization": {
      "kind": "llama-cpp GGUF vocabulary (model tokenizer)",
      "model_file": "C:\\Users\\muffa\\LDLS Project 0\\models\\Llama-3.2-1B-Instruct-Q4_K_M.gguf",
      "model_file_name": "Llama-3.2-1B-Instruct-Q4_K_M.gguf",
      "vocab_size": 128256,
      "granularity": "per_node",
      "input_field": "text",
      "add_bos": false,
      "special": true,
      "total_tokens": 1729,
      "note": "Nodes are tokenized independently, so concatenating node tokens can differ by a token or two from tokenizing the whole document in one call."
    },
    "position_convention": "packed_global",
    "sequence_convention": "one_sequence_per_top_level_block",
    "sequence_assignment": {
      "mode": "blocks",
      "sequence_count": 14,
      "max_sequences": 16,
      "min_block_tokens": 16,
      "xref_links": true,
      "cross_references": [],
      "blocks": [
        {
          "node_ids": [
            "n0"
          ],
          "title": "Attention Masks, Sequence Identifiers, and Batched Inference",
          "node_count": 1,
          "token_count": 12,
          "pos_min": 0,
          "pos_max": 11,
          "merged": false,
          "seq_id": 0
        },
        {
          "node_ids": [
            "n1"
          ],
          "title": "Attention masks determine which token positions may contribute to each other dur",
          "node_count": 1,
          "token_count": 52,
          "pos_min": 12,
          "pos_max": 63,
          "merged": false,
          "seq_id": 1
        },
        {
          "node_ids": [
            "n2"
          ],
          "title": "Attention Scores",
          "node_count": 7,
          "token_count": 135,
          "pos_min": 64,
          "pos_max": 198,
          "merged": false,
          "seq_id": 2
        },
        {
          "node_ids": [
            "n9"
          ],
          "title": "Causal Visibility",
          "node_count": 5,
          "token_count": 98,
          "pos_min": 199,
          "pos_max": 296,
          "merged": false,
          "seq_id": 3
        },
        {
          "node_ids": [
            "n14"
          ],
          "title": "Independent Sequences",
          "node_count": 9,
          "token_count": 261,
          "pos_min": 297,
          "pos_max": 557,
          "merged": false,
          "seq_id": 4
        },
        {
          "node_ids": [
            "n23"
          ],
          "title": "Batched and Separate Runs",
          "node_count": 3,
          "token_count": 97,
          "pos_min": 558,
          "pos_max": 654,
          "merged": false,
          "seq_id": 5
        },
        {
          "node_ids": [
            "n26"
          ],
          "title": "Subtree Mutation Test",
          "node_count": 3,
          "token_count": 144,
          "pos_min": 655,
          "pos_max": 798,
          "merged": false,
          "seq_id": 6
        },
        {
          "node_ids": [
            "n29"
          ],
          "title": "Memory and Timing",
          "node_count": 3,
          "token_count": 94,
          "pos_min": 799,
          "pos_max": 892,
          "merged": false,
          "seq_id": 7
        },
        {
          "node_ids": [
            "n32"
          ],
          "title": "Conclusion",
          "node_count": 2,
          "token_count": 60,
          "pos_min": 893,
          "pos_max": 952,
          "merged": false,
          "seq_id": 8
        },
        {
          "node_ids": [
            "n34"
          ],
          "title": "Positions During Prefill",
          "node_count": 6,
          "token_count": 292,
          "pos_min": 953,
          "pos_max": 1244,
          "merged": false,
          "seq_id": 9
        },
        {
          "node_ids": [
            "n40"
          ],
          "title": "Interpreting the Mutation Test",
          "node_count": 3,
          "token_count": 151,
          "pos_min": 1245,
          "pos_max": 1395,
          "merged": false,
          "seq_id": 10
        },
        {
          "node_ids": [
            "n43"
          ],
          "title": "Interpreting the Eviction Test",
          "node_count": 3,
          "token_count": 144,
          "pos_min": 1396,
          "pos_max": 1539,
          "merged": false,
          "seq_id": 11
        },
        {
          "node_ids": [
            "n46"
          ],
          "title": "Reproducibility",
          "node_count": 3,
          "token_count": 131,
          "pos_min": 1540,
          "pos_max": 1670,
          "merged": false,
          "seq_id": 12
        },
        {
          "node_ids": [
            "n49"
          ],
          "title": "Conclusion",
          "node_count": 2,
          "token_count": 58,
          "pos_min": 1671,
          "pos_max": 1728,
          "merged": false,
          "seq_id": 13
        }
      ]
    },
    "ownership_convention": "Each node owns only its own text; descendant text is never copied into ancestors, so every token is assigned to exactly one node.",
    "text_convention": "text is a deterministic meaning-preserving linear rendering of the node's latex field. Grouping braces are retained so subscripts, superscripts and grouping stay explicit; unmapped control sequences are preserved verbatim.",
    "dropped_content_free_commands": [
      "maketitle"
    ],
    "unresolved_commands": {
      "count": 0,
      "commands": []
    },
    "content_loss_audit": {
      "lost": [],
      "invented": [],
      "dropped": [
        "maketitle"
      ]
    }
  },
  "nodes": [
    {
      "id": "n0",
      "node_type": "document",
      "parent": null,
      "text": "Attention Masks, Sequence Identifiers, and Batched Inference",
      "latex": "Attention Masks, Sequence Identifiers, and Batched Inference",
      "tokens": [
        70429,
        62232,
        11,
        29971,
        23322,
        12099,
        11,
        323,
        35004,
        291,
        763,
        2251
      ],
      "positions": [
        0,
        1,
        2,
        3,
        4,
        5,
        6,
        7,
        8,
        9,
        10,
        11
      ],
      "seq_ids": [
        0,
        0,
        0,
        0,
        0,
        0,
        0,
        0,
        0,
        0,
        0,
        0
      ],
      "token_count": 12,
      "source_span": [
        0,
        10254
      ],
      "child_ids": [
        "n1",
        "n2",
        "n9",
        "n14",
        "n23",
        "n26",
        "n29",
        "n32",
        "n34",
        "n40",
        "n43",
        "n46",
        "n49"
      ],
      "labels": [],
      "references": [],
      "unresolved_commands": []
    },
    {
      "id": "n1",
      "node_type": "abstract",
      "parent": "n0",
      "text": "Attention masks determine which token positions may contribute to each other during Transformer inference. When independent prompts are processed in a shared batch, sequence membership and position handling must prevent unintended interactions. This document introduces a simplified mask formulation and outlines tests for a batched inference implementation.",
      "latex": "\nAttention masks determine which token positions may contribute to each other during Transformer inference. When independent prompts are processed in a shared batch, sequence membership and position handling must prevent unintended interactions. This document introduces a simplified mask formulation and outlines tests for a batched inference implementation.\n",
      "tokens": [
        70429,
        27227,
        8417,
        902,
        4037,
        10093,
        1253,
        17210,
        311,
        1855,
        1023,
        2391,
        63479,
        45478,
        13,
        3277,
        9678,
        52032,
        527,
        15590,
        304,
        264,
        6222,
        7309,
        11,
        8668,
        16250,
        323,
        2361,
        11850,
        2011,
        5471,
        73443,
        22639,
        13,
        1115,
        2246,
        40019,
        264,
        44899,
        7056,
        55986,
        323,
        50729,
        7177,
        369,
        264,
        7309,
        291,
        45478,
        8292,
        13
      ],
      "positions": [
        12,
        13,
        14,
        15,
        16,
        17,
        18,
        19,
        20,
        21,
        22,
        23,
        24,
        25,
        26,
        27,
        28,
        29,
        30,
        31,
        32,
        33,
        34,
        35,
        36,
        37,
        38,
        39,
        40,
        41,
        42,
        43,
        44,
        45,
        46,
        47,
        48,
        49,
        50,
        51,
        52,
        53,
        54,
        55,
        56,
        57,
        58,
        59,
        60,
        61,
        62,
        63
      ],
      "seq_ids": [
        1,
        1,
        1,
        1,
        1,
        1,
        1,
        1,
        1,
        1,
        1,
        1,
        1,
        1,
        1,
        1,
        1,
        1,
        1,
        1,
        1,
        1,
        1,
        1,
        1,
        1,
        1,
        1,
        1,
        1,
        1,
        1,
        1,
        1,
        1,
        1,
        1,
        1,
        1,
        1,
        1,
        1,
        1,
        1,
        1,
        1,
        1,
        1,
        1,
        1,